 <!DOCTYPE module SYSTEM "module.dtd">

<module name="decawave_serial_communication" dir="decawave">
	<doc>
		<description>
			Decawave DWM1000 module serial communication
		</description>
	</doc>
	<header>
		<file name="decawave_serial_communication.h" />
	</header>
	<init fun="decawave_serial_communication_init()" />
	<periodic fun="decawave_serial_communication_periodic()" freq="30" autorun="TRUE" />
	<event fun="decawave_serial_communication_event()"/>
	<makefile target="ap">
		<file name="decawave_serial_communication.c" />
		<configure name="SERIAL_UART" default="uart2" case="upper|lower" />
		<configure name="SERIAL_BAUD" default="B9600" />
		<configure name="SERIAL_LED" default="3" />
		<define name="USE_$(SERIAL_UART_UPPER)" />
		<define name="SERIAL_UART" value="$(SERIAL_UART_LOWER)" />
		<define name="$(SERIAL_UART_UPPER)_BAUD" value="$(SERIAL_BAUD)" />
	</makefile>
</module>