<!DOCTYPE module SYSTEM "module.dtd">

<module name="extra_dl" dir="datalink">
  <doc>
    <description>Extra datalink (PPRZ transport)</description>
    <configure name="EXTRA_DL_PORT" value="UARTX|UDPX" description="Select port for extra datalink"/>
    <configure name="EXTRA_DL_BAUD" value="B57600" description="Baudrate for extra datalink if link device is UART"/>
  </doc>
  <header>
    <file name="extra_pprz_dl.h"/>
  </header>
  <init fun="extra_pprz_dl_init()"/>
  <periodic fun="extra_pprz_dl_periodic()" freq="PERIODIC_FREQUENCY" autorun="TRUE"/>
  <event fun="ExtraDatalinkEvent()"/>
  <makefile target="ap">
    <configure name="EXTRA_DL_PORT" default="uart1" case="upper|lower"/>
    <define name="EXTRA_DOWNLINK_DEVICE" value="$(EXTRA_DL_PORT_LOWER)"/>
    <define name="USE_$(EXTRA_DL_PORT_UPPER)"/>
    <raw>
      ifneq (,$(findstring udp,$(EXTRA_DL_PORT_LOWER)))
      include $(CFG_SHARED)/udp.makefile
      else
      EXTRA_DL_BAUD ?= B57600
      $(TARGET).CFLAGS += -D$(EXTRA_DL_PORT_UPPER)_BAUD=$(EXTRA_DL_BAUD)
      endif
    </raw>
    <file name="extra_pprz_dl.c"/>
    <file name="pprz_transport.c" dir="pprzlink/src"/>
  </makefile>
</module>
