<!DOCTYPE module SYSTEM "module.dtd">

<module name="nav_survey_zamboni" dir="nav">
  <doc>
    <description>
     Zamboni pattern survey for fixedwings.
    </description>
  </doc>
  <header>
    <file name="nav_survey_zamboni.h"/>
  </header>
  <makefile target="ap|sim|nps">
    <file name="nav_survey_zamboni.c"/>
    <test firmware="fixedwing">
      <define name="CTRL_TYPE_H" value="firmwares/fixedwing/guidance/guidance_v.h" type="string"/>
    </test>
  </makefile>
</module>
