<!DOCTYPE module SYSTEM "module.dtd">

<module name="core">
  <doc>
    <description>Extra datalink channel (PPRZ transport)</description>
  </doc>
  <header>
    <file name="extra_pprz_dl.h"/>
  </header>
  <event fun="ExtraDatalinkEvent()"/>
  <makefile>
    <define name="EXTRA_DOWNLINK_DEVICE" value="Uart0"/>
    <define name="EXTRA_PPRZ_UART" value="Uart0"/>
    <define name="USE_UART0"/>
    <define name="UART0_BAUD" value="B57600"/>
    <define name="UART0_VIC_SLOT" value="5"/>
    <file name="extra_pprz_dl.c"/>
  </makefile>
</module>

